{"dispositions":[{"atoms":[{"block_id":"M050-SRC-AUTHORIAL-GRAMMAR-001__B00081_471dd5588948","claim_kind":"orthography_rule","exact_source_text":"A noun or noun phrase receives **Initial Caps** when MEDIAN gives it a stable, defined game meaning that differs from, narrows, or formalizes ordinary English usage.","normalized_claim":"Initial Caps applies to a noun/noun phrase when it has a stable, defined game meaning distinct from ordinary usage.","proposal_id":"P-B00081-01","source_id":"M050-SRC-AUTHORIAL-GRAMMAR-001","stream":"evidence_authorial_rule"}],"block_id":"M050-SRC-AUTHORIAL-GRAMMAR-001__B00081_471dd5588948","kind":"atoms"},{"atoms":[],"block_id":"M050-SRC-AUTHORIAL-GRAMMAR-001__B00083_1a3fe43e01bb","kind":"no_substantive_claim"},{"atoms":[{"block_id":"M050-SRC-AUTHORIAL-GRAMMAR-001__B00085_89c840d34203","claim_kind":"example_list","exact_source_text":"```text\nCitizen\nColony\nPlace\nPractice\nProject\nRole\nMode\nRegister\nView\nBody Unit\nExposure\nQuiet Equilibrium\nChronicle\nAlmanac\nHome\nAway\n```\n","normalized_claim":"Lists example terms illustrative of the Initial Caps rule.","proposal_id":"P-B00085-01","source_id":"M050-SRC-AUTHORIAL-GRAMMAR-001","stream":"evidence_authorial_rule"}],"block_id":"M050-SRC-AUTHORIAL-GRAMMAR-001__B00085_89c840d34203","kind":"atoms"},{"atoms":[],"block_id":"M050-SRC-AUTHORIAL-GRAMMAR-001__B00087_25f6b2e32ce1","kind":"no_substantive_claim"},{"atoms":[{"block_id":"M050-SRC-AUTHORIAL-GRAMMAR-001__B00089_e9c48c5dbde2","claim_kind":"negative_test","exact_source_text":"> Is this noun important?","normalized_claim":"Rejected test for Initial Caps: importance of the noun is not the governing criterion.","proposal_id":"P-B00089-01","source_id":"M050-SRC-AUTHORIAL-GRAMMAR-001","stream":"evidence_authorial_rule"}],"block_id":"M050-SRC-AUTHORIAL-GRAMMAR-001__B00089_e9c48c5dbde2","kind":"atoms"},{"atoms":[],"block_id":"M050-SRC-AUTHORIAL-GRAMMAR-001__B00091_cefc5e71a60e","kind":"no_substantive_claim"},{"atoms":[{"block_id":"M050-SRC-AUTHORIAL-GRAMMAR-001__B00093_d17c8c408b1d","claim_kind":"governing_test","exact_source_text":"> Could this term receive a definition, MSID, glossary entry, stable cross-document reference, or explicit owner?","normalized_claim":"Governing test for Initial Caps: whether the term could receive a definition, MSID, glossary entry, stable cross-document reference, or explicit owner.","proposal_id":"P-B00093-01","source_id":"M050-SRC-AUTHORIAL-GRAMMAR-001","stream":"evidence_authorial_rule"}],"block_id":"M050-SRC-AUTHORIAL-GRAMMAR-001__B00093_d17c8c408b1d","kind":"atoms"},{"atoms":[{"block_id":"M050-SRC-AUTHORIAL-GRAMMAR-001__B00095_5c7fe3f5cb04","claim_kind":"conditional_rule","exact_source_text":"If yes, Initial Caps may be warranted.","normalized_claim":"If the governing test is satisfied, Initial Caps may be warranted (permissive, not mandatory).","proposal_id":"P-B00095-01","source_id":"M050-SRC-AUTHORIAL-GRAMMAR-001","stream":"evidence_authorial_rule"}],"block_id":"M050-SRC-AUTHORIAL-GRAMMAR-001__B00095_5c7fe3f5cb04","kind":"atoms"},{"atoms":[{"block_id":"M050-SRC-AUTHORIAL-GRAMMAR-001__B00099_3c3157b6b149","claim_kind":"prohibition","exact_source_text":"Do not capitalize ordinary prose merely to make it feel weighty.","normalized_claim":"Prohibits capitalizing ordinary prose solely for rhetorical weight.","proposal_id":"P-B00099-01","source_id":"M050-SRC-AUTHORIAL-GRAMMAR-001","stream":"evidence_authorial_rule"}],"block_id":"M050-SRC-AUTHORIAL-GRAMMAR-001__B00099_3c3157b6b149","kind":"atoms"},{"atoms":[],"block_id":"M050-SRC-AUTHORIAL-GRAMMAR-001__B00101_3623714e4182","kind":"no_substantive_claim"},{"atoms":[],"block_id":"M050-SRC-AUTHORIAL-GRAMMAR-001__B00105_6cb1009833c7","kind":"no_substantive_claim"},{"atoms":[{"block_id":"M050-SRC-AUTHORIAL-GRAMMAR-001__B00115_99783b6a1d06","claim_kind":"authoring_guidance","exact_source_text":"Where ambiguity is likely, rewrite rather than relying on capitalization alone.","normalized_claim":"When ambiguity is likely, authors should rewrite prose rather than rely solely on capitalization to disambiguate.","proposal_id":"P-B00115-01","source_id":"M050-SRC-AUTHORIAL-GRAMMAR-001","stream":"evidence_authorial_rule"}],"block_id":"M050-SRC-AUTHORIAL-GRAMMAR-001__B00115_99783b6a1d06","kind":"atoms"},{"atoms":[{"block_id":"M050-SRC-AUTHORIAL-GRAMMAR-001__B00119_052480e51c64","claim_kind":"orthography_rule","exact_source_text":"Capitalize the significant elements of a Defined Term:","normalized_claim":"Multiword Defined Terms should have their significant elements capitalized.","proposal_id":"P-B00119-01","source_id":"M050-SRC-AUTHORIAL-GRAMMAR-001","stream":"evidence_authorial_rule"}],"block_id":"M050-SRC-AUTHORIAL-GRAMMAR-001__B00119_052480e51c64","kind":"atoms"},{"atoms":[{"block_id":"M050-SRC-AUTHORIAL-GRAMMAR-001__B00121_56839f09cc53","claim_kind":"example_list","exact_source_text":"```text\nBody Unit\nQuiet Equilibrium\nContinuous Run\nCommunity Board\nGathering Place\nPrior-life Tale\n```\n","normalized_claim":"Lists example multiword Defined Terms illustrating capitalization of significant elements.","proposal_id":"P-B00121-01","source_id":"M050-SRC-AUTHORIAL-GRAMMAR-001","stream":"evidence_authorial_rule"}],"block_id":"M050-SRC-AUTHORIAL-GRAMMAR-001__B00121_56839f09cc53","kind":"atoms"},{"atoms":[{"block_id":"M050-SRC-AUTHORIAL-GRAMMAR-001__B00123_4e30e0ba3f70","claim_kind":"orthography_rule","exact_source_text":"Articles, conjunctions, and internal prepositions remain lowercase unless the canonical term begins with them.","normalized_claim":"Within multiword Defined Terms, articles, conjunctions, and internal prepositions stay lowercase unless the canonical term begins with them.","proposal_id":"P-B00123-01","source_id":"M050-SRC-AUTHORIAL-GRAMMAR-001","stream":"evidence_authorial_rule"}],"block_id":"M050-SRC-AUTHORIAL-GRAMMAR-001__B00123_4e30e0ba3f70","kind":"atoms"},{"atoms":[{"block_id":"M050-SRC-AUTHORIAL-GRAMMAR-001__B00131_58e32cffd92c","claim_kind":"definitional_list_intro","exact_source_text":"The five canonical experiential operators are:","normalized_claim":"There are exactly five canonical experiential operators, introduced by this statement.","proposal_id":"P-B00131-01","source_id":"M050-SRC-AUTHORIAL-GRAMMAR-001","stream":"evidence_authorial_rule"}],"block_id":"M050-SRC-AUTHORIAL-GRAMMAR-001__B00131_58e32cffd92c","kind":"atoms"},{"atoms":[{"block_id":"M050-SRC-AUTHORIAL-GRAMMAR-001__B00133_6414bad8a1ba","claim_kind":"canonical_mapping","exact_source_text":"```text\nColony       : DWELL\nField        : TRAVEL\nCrossing     : RISK\nEncounter    : MEET\nEmbodiment   : EMBODY\n```\n","normalized_claim":"Lists the five canonical Register:Operator pairs: Colony:DWELL, Field:TRAVEL, Crossing:RISK, Encounter:MEET, Embodiment:EMBODY.","proposal_id":"P-B00133-01","source_id":"M050-SRC-AUTHORIAL-GRAMMAR-001","stream":"evidence_authorial_rule"}],"block_id":"M050-SRC-AUTHORIAL-GRAMMAR-001__B00133_6414bad8a1ba","kind":"atoms"},{"atoms":[{"block_id":"M050-SRC-AUTHORIAL-GRAMMAR-001__B00135_b9381866d787","claim_kind":"semantic_typography_rule","exact_source_text":"ALL CAPS identifies the operator through which the player acts. It does not replace the Register noun.","normalized_claim":"ALL CAPS marks the operator through which the player acts, and does not substitute for the Register noun.","proposal_id":"P-B00135-01","source_id":"M050-SRC-AUTHORIAL-GRAMMAR-001","stream":"evidence_authorial_rule"}],"block_id":"M050-SRC-AUTHORIAL-GRAMMAR-001__B00135_b9381866d787","kind":"atoms"},{"atoms":[],"block_id":"M050-SRC-AUTHORIAL-GRAMMAR-001__B00137_b828cc3afe74","kind":"no_substantive_claim"},{"atoms":[],"block_id":"M050-SRC-AUTHORIAL-GRAMMAR-001__B00141_99adcd013e48","kind":"no_substantive_claim"},{"atoms":[{"block_id":"M050-SRC-AUTHORIAL-GRAMMAR-001__B00147_31327bcbabf7","claim_kind":"canonical_mapping","exact_source_text":"```text\nMouse        : JOIN\nRabbit       : GATHER\nSquirrel     : CONNECT\n```\n","normalized_claim":"Lists Core-Species to spatial operator mappings: Mouse:JOIN, Rabbit:GATHER, Squirrel:CONNECT.","proposal_id":"P-B00147-01","source_id":"M050-SRC-AUTHORIAL-GRAMMAR-001","stream":"evidence_authorial_rule"}],"block_id":"M050-SRC-AUTHORIAL-GRAMMAR-001__B00147_31327bcbabf7","kind":"atoms"},{"atoms":[{"block_id":"M050-SRC-AUTHORIAL-GRAMMAR-001__B00149_9f461f36e392","claim_kind":"scope_restriction","exact_source_text":"These are canonical spatial and civilizational operators, not general-purpose emphatic verbs.","normalized_claim":"Core-Species ALL CAPS operators are canonical spatial/civilizational operators, not general emphatic verbs.","proposal_id":"P-B00149-01","source_id":"M050-SRC-AUTHORIAL-GRAMMAR-001","stream":"evidence_authorial_rule"}],"block_id":"M050-SRC-AUTHORIAL-GRAMMAR-001__B00149_9f461f36e392","kind":"atoms"},{"atoms":[],"block_id":"M050-SRC-AUTHORIAL-GRAMMAR-001__B00151_b828cc3afe74","kind":"no_substantive_claim"},{"atoms":[{"block_id":"M050-SRC-AUTHORIAL-GRAMMAR-001__B00157_4848b16de1ab","claim_kind":"prohibition","exact_source_text":"Do not capitalize every player action.","normalized_claim":"Prohibits capitalizing every player action; ordinary verbs remain ordinary.","proposal_id":"P-B00157-01","source_id":"M050-SRC-AUTHORIAL-GRAMMAR-001","stream":"evidence_authorial_rule"}],"block_id":"M050-SRC-AUTHORIAL-GRAMMAR-001__B00157_4848b16de1ab","kind":"atoms"},{"atoms":[],"block_id":"M050-SRC-AUTHORIAL-GRAMMAR-001__B00161_6cb1009833c7","kind":"no_substantive_claim"},{"atoms":[{"block_id":"M050-SRC-AUTHORIAL-GRAMMAR-001__B00165_6a674b106ea2","claim_kind":"scope_restriction","exact_source_text":"ALL CAPS is reserved for the canonical operator inventory.","normalized_claim":"ALL CAPS usage is restricted to the canonical operator inventory only.","proposal_id":"P-B00165-01","source_id":"M050-SRC-AUTHORIAL-GRAMMAR-001","stream":"evidence_authorial_rule"}],"block_id":"M050-SRC-AUTHORIAL-GRAMMAR-001__B00165_6a674b106ea2","kind":"atoms"},{"atoms":[{"block_id":"M050-SRC-AUTHORIAL-GRAMMAR-001_